{"cases":[],"clues":{"extracted.fixture.fixture.time_gap":{"facets":[{"frame":"record","key":"extracted.fixture.fixture.time_gap:record","meaning":"서로 모순되는 시각 기록","note":"서로 모순되는 시각 기록","tags":["논리","신중"]}],"id":"extracted.fixture.fixture.time_gap","kind":"기록","name":"시각의 공백","suit":"documentary","tags":["논리","신중"],"text":"서로 모순되는 시각 기록"}},"format":"game-data-pack","formatVersion":2,"id":"extracted.fixture","mergeMode":"alongside","promotionTargets":[],"provenance":{"inputSha256":"1de65ab9bad466225367ae69aa162ecc7a5c9e995c9c92d0b7b961cd4e6f140f","outputSha256":"8c4583d69b71220c9a6d8aafa877aaa65f6198518f2d91d1b176708a83170706","rawResponseSha256":"15566f4d2e8433ddfac099c61a29fbcf7c741c90ab74cd5b7f84444b128682bd","sourceSnapshotIds":["fixture:facet-contract"],"validatorVersion":"facet-contract-v1"}}
