{"cases":[{"axis":{"drivenBy":"논리","high":"의심","hint":"논리적 대조가 익숙해서 보이지 않던 사람을 수사선 위로 끌어낸다.","id":"generated.pg204-invisible-man.visibility","init":3,"label":"가시성","low":"익숙함"},"contextHint":"사건 현장은 완벽하게 정리되었으나, 논리의 틈새와 습관의 반복 속에서 미세한 균열들이 발견된다. 이 균열들은 단순한 기억의 오류가 아니다.","guestClues":["omitted_witness","uniform_habit","rehearsed_story","thread_fiber"],"guestFacets":["omitted_witness:omission","uniform_habit:identity","rehearsed_story:action","thread_fiber:trace"],"guestPattern":"invisible-man","id":"generated.pg204-invisible-man.case","intro":"모든 것이 너무나 익숙해서, 오히려 가장 눈에 띄지 않는 것들이 진실을 가리킨다.","packPool":[],"patterns":["invisible-man"],"pieces":["네 증언이 겹치는 자리에는 ",". 그 공백을 통과한 존재를 설명하는 열쇠는 ",". 그 선택은 우연이 아니라 ",". 마지막으로 현장에 남은 것은 ",". 네 고리가 같은 사람을 가리킨다."],"slots":[{"answer":"omitted_witness","hit":"네 증언이 겹치는 자리에는","id":"generated.pg204-invisible-man.witness-gap","label":"목격의 맹점","role":{"accepts":["사람","행위"],"frame":"omission"}},{"answer":"uniform_habit","hit":"그 자리에 있어야 할 목격자의 존재 자체가 공백으로 처리되었다.","id":"generated.pg204-invisible-man.social-mask","label":"사회적 위장","role":{"accepts":["사람","행위"],"frame":"identity"}},{"answer":"rehearsed_story","hit":"사건 발생 전후로 반복된 그의 사소한 행동 패턴은, 마치 연기처럼 계산되어 있었다.","id":"generated.pg204-invisible-man.routine-action","label":"반복된 행동","role":{"accepts":["행위"],"frame":"action"}},{"answer":"thread_fiber","hit":"바닥에 남겨진 미세한 섬유 조각 하나가, 모든 것을 엮는 논리적 실마리가 되었다.","id":"generated.pg204-invisible-man.physical-trace","label":"남겨진 흔적","role":{"accepts":["사물","현상"],"frame":"trace"}}],"teaser":"그날 밤, 모두가 보았다고 확신했던 것들 사이에서, 단 하나의 '없음'이 모든 것을 뒤흔든다.","title":"눈보라 속의 그림자"}],"format":"game-data-pack","formatVersion":2,"id":"generated.pg204-invisible-man","interludes":[{"actions":[{"cost":1,"id":"generated.pg204-invisible-man.interlude.recon","kind":"recon","label":"눈보라 기록 대조","resultText":"눈보라 속의 그림자","revealKind":"background","revealValue":"눈보라 속의 그림자"},{"cost":1,"guestFacetKey":"omitted_witness:omission","id":"generated.pg204-invisible-man.interlude.interview","kind":"interview","label":"빠진 목격자 확인","resultText":"다음 사건에서 공개된 목격 측면 하나를 빌린다."},{"cost":1,"delta":-1,"id":"generated.pg204-invisible-man.interlude.stabilize","kind":"stabilize","label":"수사선 정돈","resultText":"새 사건으로 넘어가기 전에 과열된 수사선을 정돈한다.","stat":"heat"}],"afterCaseId":"boss","apBudget":2,"beforeCaseId":"generated.pg204-invisible-man.case","id":"generated.pg204-invisible-man.interlude.boss-case","presentation":"완결된 사건부 뒤에 도착한 눈보라 기록이 다음 수사선을 연다.","provenance":{"inputSha256":"e22c166ea1dc76d0735c06f9de984aeb7688db487397f25be92f9d1bce83227d","modelId":"casegen-gemma-e4b","outputSha256":"a8e042ace415a398816bf460c301d9bd1e5cca614622c837e203b722b0a9948d","promptVersion":"selector@1+presenter@1+taste@1","rawResponseSha256":"7c11e4bb83c4461ef926278e0ac8877312084d500cf5d05e95ed167cb1a30351","seed":428,"sourceSnapshotIds":["pg204-invisible-man-01","pg204-invisible-man-02","pg204-invisible-man-03","pg204-invisible-man-04","pg204-invisible-man-05"],"validatorVersion":"generated-case-e2e@1"}}],"mergeMode":"alongside","name":"PG204 · 눈 위의 배달부","provenance":{"inputSha256":"e22c166ea1dc76d0735c06f9de984aeb7688db487397f25be92f9d1bce83227d","modelId":"casegen-gemma-e4b","outputSha256":"a8e042ace415a398816bf460c301d9bd1e5cca614622c837e203b722b0a9948d","promptVersion":"selector@1+presenter@1+taste@1","rawResponseSha256":"7c11e4bb83c4461ef926278e0ac8877312084d500cf5d05e95ed167cb1a30351","seed":428,"sourceSnapshotIds":["pg204-invisible-man-01","pg204-invisible-man-02","pg204-invisible-man-03","pg204-invisible-man-04","pg204-invisible-man-05"],"validatorVersion":"generated-case-e2e@1"},"version":"1.0.0"}
